[
  {
    "item_id": "threads-synth-rule-eval-0001",
    "schema_version": "thread_item_schema_v1",
    "source_platform": "threads",
    "source_type": "researcher_synthetic",
    "collection_batch_id": "rule_baseline_eval_synthetic_2026-04",
    "collection_timestamp": "2026-04-23T18:00:00+08:00",
    "collection_method": "synthetic",
    "authorization_status": "synthetic_only",
    "post_text": "Copy trading signals are open for new members. Fixed ROI examples are posted for beginners.",
    "reply_texts": ["Join the private Telegram group for the first lesson."],
    "image_paths": [],
    "image_count": 0,
    "has_image": false,
    "has_reply": true,
    "has_external_link": false,
    "external_links": [],
    "visible_contact_handles": ["telegram:[redacted_synthetic_handle]"],
    "visible_platform_redirects": ["telegram"],
    "ocr_text": "",
    "language": "en",
    "screenshot_style": "none",
    "scam_label": "scam",
    "scam_type": ["investment_lure", "guaranteed_profit_claim", "redirect_to_private_chat"],
    "risk_level": "high",
    "signal_tags": ["guaranteed_or_risk_free_claim", "private_channel_redirect", "contact_handle_visible"],
    "evidence_sufficiency": "sufficient",
    "annotation_confidence": "high",
    "annotation_notes": "Synthetic eval investment lure.",
    "annotator_id": "ann_synthetic",
    "reviewer_id": "",
    "review_status": "annotated",
    "adjudication_status": "not_needed",
    "disagreement_flag": false,
    "final_label": "",
    "final_risk_level": "",
    "source_url_if_stored": "",
    "screenshot_snapshot_status": "not_applicable",
    "link_snapshot_status": "not_applicable",
    "metadata_notes": "Synthetic eval case.",
    "privacy_redaction_notes": "No real personal data.",
    "dedupe_key": "synthetic-rule-eval:copytrade-fixed-roi",
    "near_duplicate_group_id": "synthetic-rule-eval-investment",
    "missing_evidence": ["none"],
    "baseline_split": "test"
  },
  {
    "item_id": "threads-synth-rule-eval-0002",
    "schema_version": "thread_item_schema_v1",
    "source_platform": "threads",
    "source_type": "researcher_synthetic",
    "collection_batch_id": "rule_baseline_eval_synthetic_2026-04",
    "collection_timestamp": "2026-04-23T18:05:00+08:00",
    "collection_method": "synthetic",
    "authorization_status": "synthetic_only",
    "post_text": "Look at the screenshot for instructions.",
    "reply_texts": [],
    "image_paths": ["data/samples/synthetic-rule-eval-0002-placeholder.png"],
    "image_count": 1,
    "has_image": true,
    "has_reply": false,
    "has_external_link": true,
    "external_links": ["https://example.invalid/eval-redacted"],
    "visible_contact_handles": ["whatsapp:[redacted_synthetic_handle]"],
    "visible_platform_redirects": ["whatsapp", "external_site"],
    "ocr_text": "Withdrawal proof from members. Act now. Add WhatsApp [redacted] for registration.",
    "language": "en",
    "screenshot_style": "screenshot_heavy",
    "scam_label": "scam",
    "scam_type": ["suspicious_testimonial", "redirect_to_private_chat", "urgency_scarcity_pressure"],
    "risk_level": "high",
    "signal_tags": ["testimonial_or_earnings_screenshot", "private_channel_redirect", "visible_external_link", "contact_handle_visible", "urgency_or_scarcity", "ocr_only_lure"],
    "evidence_sufficiency": "sufficient",
    "annotation_confidence": "high",
    "annotation_notes": "Synthetic eval OCR screenshot redirect.",
    "annotator_id": "ann_synthetic",
    "reviewer_id": "",
    "review_status": "annotated",
    "adjudication_status": "not_needed",
    "disagreement_flag": false,
    "final_label": "",
    "final_risk_level": "",
    "source_url_if_stored": "",
    "screenshot_snapshot_status": "captured_redacted",
    "link_snapshot_status": "not_captured",
    "metadata_notes": "Synthetic example.invalid link must not be crawled.",
    "privacy_redaction_notes": "No real personal data.",
    "dedupe_key": "synthetic-rule-eval:withdrawal-whatsapp",
    "near_duplicate_group_id": "synthetic-rule-eval-ocr",
    "missing_evidence": ["link_snapshot_missing"],
    "baseline_split": "test"
  },
  {
    "item_id": "threads-synth-rule-eval-0003",
    "schema_version": "thread_item_schema_v1",
    "source_platform": "threads",
    "source_type": "researcher_synthetic",
    "collection_batch_id": "rule_baseline_eval_synthetic_2026-04",
    "collection_timestamp": "2026-04-23T18:10:00+08:00",
    "collection_method": "synthetic",
    "authorization_status": "synthetic_only",
    "post_text": "I wrote a short note about composting and soil temperature after this week's rain.",
    "reply_texts": ["Helpful, thanks for sharing."],
    "image_paths": [],
    "image_count": 0,
    "has_image": false,
    "has_reply": true,
    "has_external_link": false,
    "external_links": [],
    "visible_contact_handles": [],
    "visible_platform_redirects": ["none"],
    "ocr_text": "",
    "language": "en",
    "screenshot_style": "none",
    "scam_label": "non_scam",
    "scam_type": ["none"],
    "risk_level": "low",
    "signal_tags": ["none"],
    "evidence_sufficiency": "sufficient",
    "annotation_confidence": "high",
    "annotation_notes": "Synthetic eval benign post.",
    "annotator_id": "ann_synthetic",
    "reviewer_id": "",
    "review_status": "annotated",
    "adjudication_status": "not_needed",
    "disagreement_flag": false,
    "final_label": "",
    "final_risk_level": "",
    "source_url_if_stored": "",
    "screenshot_snapshot_status": "not_applicable",
    "link_snapshot_status": "not_applicable",
    "metadata_notes": "Synthetic benign comparator.",
    "privacy_redaction_notes": "No real personal data.",
    "dedupe_key": "synthetic-rule-eval:benign-compost",
    "near_duplicate_group_id": "",
    "missing_evidence": ["none"],
    "baseline_split": "test"
  },
  {
    "item_id": "threads-synth-rule-eval-0004",
    "schema_version": "thread_item_schema_v1",
    "source_platform": "threads",
    "source_type": "researcher_synthetic",
    "collection_batch_id": "rule_baseline_eval_synthetic_2026-04",
    "collection_timestamp": "2026-04-23T18:15:00+08:00",
    "collection_method": "synthetic",
    "authorization_status": "synthetic_only",
    "post_text": "Do any beginners here use a budgeting app before investing? I am comparing different methods.",
    "reply_texts": ["I track expenses first.", "Risk depends on your personal situation."],
    "image_paths": [],
    "image_count": 0,
    "has_image": false,
    "has_reply": true,
    "has_external_link": false,
    "external_links": [],
    "visible_contact_handles": [],
    "visible_platform_redirects": ["none"],
    "ocr_text": "",
    "language": "en",
    "screenshot_style": "none",
    "scam_label": "uncertain",
    "scam_type": ["investment_lure"],
    "risk_level": "low",
    "signal_tags": ["vague_offer_strong_benefit"],
    "evidence_sufficiency": "partial",
    "annotation_confidence": "low",
    "annotation_notes": "Synthetic eval ambiguous finance discussion.",
    "annotator_id": "ann_synthetic",
    "reviewer_id": "",
    "review_status": "needs_second_review",
    "adjudication_status": "pending",
    "disagreement_flag": false,
    "final_label": "",
    "final_risk_level": "",
    "source_url_if_stored": "",
    "screenshot_snapshot_status": "not_applicable",
    "link_snapshot_status": "not_applicable",
    "metadata_notes": "Synthetic ambiguity case.",
    "privacy_redaction_notes": "No real personal data.",
    "dedupe_key": "synthetic-rule-eval:ambiguous-budgeting-investing",
    "near_duplicate_group_id": "",
    "missing_evidence": ["source_context_missing"],
    "baseline_split": "audit_holdout"
  },
  {
    "item_id": "threads-synth-rule-eval-0005",
    "schema_version": "thread_item_schema_v1",
    "source_platform": "threads",
    "source_type": "researcher_synthetic",
    "collection_batch_id": "rule_baseline_eval_synthetic_2026-04",
    "collection_timestamp": "2026-04-23T18:20:00+08:00",
    "collection_method": "synthetic",
    "authorization_status": "synthetic_only",
    "post_text": "Official reward notice is in the screenshot.",
    "reply_texts": ["The support account says to pay a small verification fee before the bonus is released."],
    "image_paths": ["data/samples/synthetic-rule-eval-0005-placeholder.png"],
    "image_count": 1,
    "has_image": true,
    "has_reply": true,
    "has_external_link": false,
    "external_links": [],
    "visible_contact_handles": ["line:[redacted_synthetic_handle]"],
    "visible_platform_redirects": ["line"],
    "ocr_text": "Verify your account today. Pay release fee. Message LINE support for the reward.",
    "language": "en",
    "screenshot_style": "screenshot_heavy",
    "scam_label": "scam",
    "scam_type": ["giveaway_reward_prize_lure", "impersonation_pseudo_official", "redirect_to_private_chat"],
    "risk_level": "high",
    "signal_tags": ["pseudo_official_language", "payment_deposit_or_fee_request", "credential_or_personal_data_request", "private_channel_redirect", "contact_handle_visible", "ocr_only_lure", "reply_only_lure"],
    "evidence_sufficiency": "sufficient",
    "annotation_confidence": "high",
    "annotation_notes": "Synthetic eval reward-fee screenshot and reply-funnel case.",
    "annotator_id": "ann_synthetic",
    "reviewer_id": "",
    "review_status": "annotated",
    "adjudication_status": "not_needed",
    "disagreement_flag": false,
    "final_label": "",
    "final_risk_level": "",
    "source_url_if_stored": "",
    "screenshot_snapshot_status": "captured_redacted",
    "link_snapshot_status": "not_applicable",
    "metadata_notes": "Synthetic reward/fee case.",
    "privacy_redaction_notes": "No real personal data.",
    "dedupe_key": "synthetic-rule-eval:official-reward-fee",
    "near_duplicate_group_id": "synthetic-rule-eval-reward",
    "missing_evidence": ["none"],
    "baseline_split": "test"
  },
  {
    "item_id": "threads-synth-rule-eval-0006",